{
  "id": "obs-1700000000100",
  "naam": "Voorbeeldobservatie eenheden",
  "icon": "📏",
  "uitleg": "Eenheden ontbreken bij het antwoord.",
  "leeradvies": "Schrijf bij elk antwoord de eenheid.",
  "schoolsoort": ["Havo"],
  "subjects": ["nat", "schk"],
  "jaarlagen": ["3", "4"],
  "_meta": {
    "rev": 2,
    "createdBy": "gebr-1700000000001",
    "createdAt": "2025-09-01T08:00:00.000Z",
    "updatedBy": "gebr-1700000000001",
    "updatedAt": "2025-10-01T12:30:00.000Z"
  }
}
